<!DOCTYPE dataset SYSTEM "src/test/datasets.dtd">
<dataset>

	<students pk="1"	student_number="11"	academic_year="1"	scholarship_status="HALF"/>
	<students pk="2"	student_number="22"	academic_year="2"	scholarship_status="NONE"/>
	<students pk="3"	student_number="33"	academic_year="3"	scholarship_status="HALF"/>
	<students pk="4"	student_number="44"	academic_year="4"	scholarship_status="FULL"/>
	<students pk="5"	student_number="55"	academic_year="1"	scholarship_status="NONE"/>
	
	<enrollments pk="1"	enrollment_number="101"	fk_students="1"	term="Y2014_1ST"/>
	
	<enrollment_sections pk="1"	fk_enrollment="1"	fk_sections="8"/>
	<enrollment_sections pk="2"	fk_enrollment="1"	fk_sections="9"/>
	<enrollment_sections pk="3"	fk_enrollment="1"	fk_sections="10"/>
	<enrollment_sections pk="4"	fk_enrollment="1"	fk_sections="11"/>
	<enrollment_sections pk="5"	fk_enrollment="1"	fk_sections="12"/>
	<enrollment_sections pk="6"	fk_enrollment="1"	fk_sections="13"/>
	<enrollment_sections pk="7"	fk_enrollment="1"	fk_sections="14"/>
	
</dataset>